<?xml version="1.0" encoding="UTF-8" standalone="yes"?>
<xs:schema version="1.0" xmlns:xs="http://www.w3.org/2001/XMLSchema">

  <xs:element name="catalog">
    <xs:complexType>
      <xs:sequence>
        <xs:element name="book">
        <xs:complexType>
          <xs:sequence>
            <xs:element name = "title" type="xs:string" />
            <xs:element name = "author" type="xs:string" />
            <xs:element name = "publishedDate" type="xs:string" />
            <xs:element name = "pages" type="xs:int" />
            <xs:element name = "chapters" type="xs:int" />
          </xs:sequence>
        </xs:complexType>
        </xs:element>
      </xs:sequence>
    </xs:complexType>
  </xs:element>

</xs:schema>

